500,Федеральная служба по надзору в сфере образования и науки,-1,-1,-1,-1,105281,5190,110177,5432,101675,4575,105303,6373,112903,7034,95588,6392,104987,4610,35,0,-11,2.3
598,Министерство образования и науки,-1,-1,55545,2509,131601,1677,140741,1704,120870,884,151031,1164,155267,1260,-1,-1,-1,-1,37,179,76,1.17
3980,Московский государственный университет имени М.В.Ломоносова,-1,-1,-1,-1,215388,6,259349,7,238330,8,-1,-1,-1,-1,-1,-1,317357,8,35,47,54,1.34
3981,Российская академия живописи, ваяния и зодчества Ильи Глазунова,-1,-1,-1,-1,110518,9,154222,8,165703,14,142925,6,137880,6,-1,-1,188928,4,22,24,-2,0.81
3984,Санкт-Петербургский государственный университет,-1,-1,-1,-1,295246,12,309064,10,351403,7,251666,5,237189,3,239119,4,235247,3,18,19,6,3.12
5963,Департамент образования и науки города Москвы,43621,1109,122240,232,164900,202,215844,910,199098,739,238143,694,240053,1190,247571,53,274042,521,68,528,368,1.9
6122,ФГБОУ ВО Дагестанский государственный педагогический университет,-1,-1,-1,-1,-1,-1,-1,-1,143745,1,-1,-1,108183,1,62300,17,58561,12,6,-6,-32,0.83
6126,ФГБОУ ВО Ивановский государственный политехнический университет,-1,-1,-1,-1,-1,-1,45534,14,-1,-1,-1,-1,-1,-1,114453,8,134663,6,26,195,-3,7.0
6127,ФГАОУ ВО Дальневосточный федеральный университет,-1,-1,-1,-1,405239,1,212920,1,99128,17,118732,10,107585,6,116889,17,128437,22,14,29,59,1.5
6128,ФГБОУ ВО Владивостокский государственный университет экономики и сервиса,-1,-1,-1,-1,-1,-1,-1,-1,213528,5,269137,5,317528,5,68530,17,76022,19,6,10,36,1.58
6129,ФГБОУ ВО Санкт-петербургский государственный технологический институт (технический университет),-1,-1,-1,-1,-1,-1,-1,-1,-1,-1,-1,-1,295657,1,181322,8,192986,7,6,6,1,3.4
6130,ФГБОУ ВО Санкт-Петербургский государственный экономический университет,-1,-1,-1,-1,-1,-1,103150,19,113297,10,132704,6,127575,3,230788,13,239429,11,26,132,109,0.5
6131,ФГБОУ ВО Высшая школа народных искусств (академия),-1,-1,-1,-1,-1,-1,-1,-1,-1,-1,138355,1,110477,11,67627,57,-1,-1,4,-38,60,2.62
6145,ФГБОУ ВО Омский государственный университет имени Ф.М. Достоевского,-1,-1,-1,-1,-1,-1,-1,-1,-1,-1,245123,1,228079,1,173919,9,217362,10,6,24,24,5.33
6146,ФГБОУ ВО Омский государственный технический университет,-1,-1,-1,-1,-1,-1,-1,-1,409425,1,367346,1,-1,-1,253147,15,207916,13,6,-17,-18,-2.17
6150,ФГБОУ ВО Омский государственный педагогический университет,-1,-1,130892,1,178756,1,108220,3,85404,5,120565,4,125118,4,81503,11,95560,10,6,17,10,1.64
6151,ФГБОУ ВО Ростовский государственный экономический университет (РИНХ),-1,-1,-1,-1,-1,-1,134002,9,97801,9,97644,8,-1,-1,100632,25,142513,26,26,6,98,1.17
6153,ФГБОУ ВО Донской государственный технический университет,-1,-1,-1,-1,114341,9,98485,8,124398,9,129983,6,149100,11,149781,27,112458,37,35,-1,126,1.91
6154,ФГБОУ ВО Сахалинский государственный университет,-1,-1,-1,-1,-1,-1,148004,1,153421,1,293710,4,199501,3,225400,13,211901,8,6,-5,-22,0.0
6160,ФГБОУ ВО Тольяттинский государственный университет,-1,-1,-1,-1,261091,1,313949,1,290211,2,369237,1,-1,-1,165386,22,205465,20,6,24,20,6.5
6163,ФГАОУ ВО Самарский национальный исследовательский университет имени академика С.П. Королева,-1,-1,413484,1,290649,2,-1,-1,220467,6,-1,-1,-1,-1,282367,1,185069,10,14,-16,9,-0.01
6165,ФГБОУ ВО Уфимский государственный авиационный технический университет,-1,-1,-1,-1,-1,-1,-1,-1,80553,14,-1,-1,-1,-1,-1,-1,132953,15,14,65,69,-1
6168,ФГБОУ ВО Тамбовский государственный технический университет,-1,-1,-1,-1,-1,-1,160979,1,200843,1,248952,1,198805,1,100121,28,122738,31,6,22,27,1.67
6169,ФГБОУ ВО Тамбовский государственный университет имени Г.Р. Державина,-1,-1,-1,-1,-1,-1,-1,-1,-1,-1,354275,1,-1,-1,106340,13,196676,10,6,84,36,1.5
6170,ФГБОУ ВО Ижевский государственный технический университет имени М.Т. Калашникова,-1,-1,-1,-1,177022,5,168447,7,130190,7,133561,7,141828,10,127601,11,142067,15,26,-15,15,2.62
6172,ФГБОУ ВО Удмуртский государственный университет,-1,-1,-1,-1,-1,-1,-1,-1,100389,6,103272,6,280125,1,71562,18,78288,21,14,-22,34,-1.17
6173,ФГБОУ ВО Национальный исследовательский Мордовский государственный университет имени Н. П. Огарева,-1,-1,294399,1,208445,2,219973,2,158980,3,203550,5,210610,5,134176,19,76693,15,6,-42,-49,1.5
6174,ФГБОУ ВО Новгородский государственный университет имени Ярослава Мудрого,-1,-1,-1,-1,49467,3,49178,3,-1,-1,187580,1,204690,3,113462,15,121119,16,6,6,6,2.17
6175,ФГБОУ ВО Томский государственный архитектурно-строительный университет,-1,-1,-1,-1,142192,8,99210,8,117497,7,211124,1,154940,4,154563,7,-1,-1,27,8,-13,0.28
6178,ФГАОУ ВО Национальный исследовательский Томский политехнический университет,-1,-1,-1,-1,-1,-1,399200,1,353321,1,283556,1,342105,1,238342,8,238824,7,6,0,-9,0.0
6180,ФГБОУ ВО Нижегородский государственный технический университет имени Р.Е. Алексеева,-1,-1,135077,12,-1,-1,-1,-1,98235,3,216593,3,227277,8,107416,6,157275,24,51,16,99,0.0
6181,ФГБОУ ВО Нижегородский государственный лингвистический университет имени Н.А.Добролюбова,-1,-1,250390,3,-1,-1,-1,-1,315101,1,213193,2,235068,2,136083,13,148590,9,6,9,3,5.25
6182,ФГБОУ ВО Нижегородский государственный архитектурно-строительный университет,-1,-1,-1,-1,134028,1,190680,1,158665,2,210770,1,221796,1,169843,6,187128,6,6,10,10,2.91
6186,ФГБОУ ВО Брянский государственный университет имени академика И.Г. Петровского,-1,-1,257227,1,135458,2,177884,2,79607,3,187640,2,176779,2,204320,14,154077,11,6,-24,-31,-1.83
6188,ФГАОУ ВО Российский государственный профессионально-педагогический университет,-1,-1,-1,-1,84308,7,108225,7,128314,6,114866,4,230661,2,78384,13,-1,-1,27,-7,52,0.24
6193,ФГАОУ ВО Национальный исследовательский ядерный университет МИФИ,-1,-1,-1,-1,-1,-1,177244,14,173725,15,161197,18,218817,1,-1,-1,218608,3,12,-9,8,0.25
6196,ФГБОУ ВО Воронежский государственный университет инженерных технологий,-1,-1,283238,1,161996,1,198944,1,226718,1,199750,1,272975,1,263728,159,100234,10,6,-61,-74,-0.17
6199,ФГБОУ ВО Воронежский государственный университет,-1,-1,-1,-1,256680,1,68184,3,101339,3,196916,2,129473,2,186169,9,166429,10,6,-10,-9,2.03
6201,ФГБОУ ВО Липецкий государственный педагогический университет имени П.П. Семенова-Тян-Шанского,-1,-1,-1,-1,-1,-1,-1,-1,173968,1,207420,1,177719,1,100623,8,129620,8,6,28,28,3.43
6203,ФГБОУ ВО Липецкий государственный технический университет,-1,-1,242445,1,180716,1,156855,1,170233,1,191123,1,188052,1,99402,9,145805,9,6,46,46,1.33
6207,ФГБОУ ВО Российский государственный университет туризма и сервиса,-1,-1,297911,1,296439,1,74663,11,166613,6,164667,6,110647,5,237167,11,-1,-1,19,217,217,0.9
6209,ФГАОУ ВО Северо-Восточный федеральный университет имени М. К. Аммосова,-1,-1,-1,-1,-1,-1,-1,-1,229823,4,231691,4,213786,2,168481,8,207496,17,6,23,80,1.33
6210,ФГБОУ ВО Тихоокеанский государственный университет,-1,-1,409428,1,264495,1,291785,1,-1,-1,308054,1,-1,-1,346624,9,247626,8,6,-28,-30,-0.31
6215,ФГБОУ ВО Саратовский национальный исследовательский государственный университет имени Н.Г. Чернышевского,-1,-1,233721,2,88498,1,80980,1,249325,2,250277,2,168835,2,98547,15,144756,17,6,46,54,1.5
6217,ФГБОУ ВО Череповецкий государственный университет,-1,-1,-1,-1,-1,-1,-1,-1,-1,-1,-1,-1,-1,-1,185448,7,218583,6,6,17,17,2.08
6219,ФГБОУ ВО Алтайский государственный университет,-1,-1,-1,-1,-1,-1,91993,7,96613,5,83932,5,91646,4,111097,21,102652,21,26,11,112,0.83
6220,ФГБОУ ВО Кузбасский государственный технический университет имени Т.Ф. Горбачева,-1,-1,-1,-1,-1,-1,-1,-1,131148,6,154295,7,140619,6,116466,17,-1,-1,8,-11,65,1.0
6221,ФГБОУ ВО Кемеровский государственный университет,-1,-1,264807,1,223320,1,141460,6,186580,6,169372,6,191221,4,409588,1,-1,-1,12,19,19,2.9
6225,ФГАОУ ВО Южно-Уральский государственный университет (национальный исследовательский университет),-1,-1,-1,-1,-1,-1,97686,9,-1,-1,-1,-1,-1,-1,151171,19,132250,26,26,35,193,0.33
6226,ФГБОУ ВО Челябинский государственный университет,-1,-1,-1,-1,57225,1,80989,1,145566,15,104478,1,163895,1,134367,29,77374,23,14,-46,-12,3.0
6230,ФГБОУ ВО Пермский государственный национальный исследовательский университет,-1,-1,307673,1,295219,1,295500,1,-1,-1,393419,1,295500,5,134366,16,158423,20,6,17,47,0.0
6235,ФГБОУ ВО  Рыбинский государственный авиационный технический университет имени П.А. Соловьева,-1,-1,-1,-1,-1,-1,-1,-1,-1,-1,271176,1,218635,1,110309,13,89072,12,6,-19,-20,0.25
6240,ФГБОУ ВО Иркутский национальный исследовательский технический университет,-1,-1,-1,-1,-1,-1,208339,1,290035,1,209882,1,322036,1,70613,16,77507,15,6,9,0,0.0
6241,ФГБОУ ВО Иркутский государственный университет,-1,-1,-1,-1,-1,-1,-1,-1,134030,4,108943,4,132029,3,130393,10,151039,9,6,15,-8,2.0
6243,ФГБОУ ВО Марийский государственный университет,-1,-1,383771,1,350747,1,-1,-1,33380,1,30681,1,-1,-1,75232,6,126887,7,6,68,80,0.67
6244,ФГБОУ ВО Поволжский государственный технологический университет,-1,-1,-1,-1,-1,-1,-1,-1,297804,1,169202,1,235423,1,74430,18,64853,18,6,-12,-12,0.67
6246,ФГБОУ ВО Кубанский государственный технологический университет,-1,-1,319358,4,79446,7,-1,-1,-1,-1,94188,4,220967,14,103031,16,85873,16,35,8,43,0.18
6247,ФГБОУ ВО Кубанский государственный университет,-1,-1,345201,1,331688,1,98528,7,112004,7,113903,6,93233,6,104607,40,98318,32,26,0,84,0.33
6249,ФГБОУ ВО Новосибирский государственный педагогический университет,-1,-1,200725,2,181883,2,171114,2,226138,2,208853,2,157846,2,145854,10,134599,11,6,-7,-3,0.79
6251,ФГБОУ ВО Новосибирский государственный университет экономики и управления НИНХ,-1,-1,233875,1,189332,1,117938,2,214516,2,213264,2,235942,2,52085,18,164844,13,6,216,50,2.42
6253,ФГБОУ ВО Новосибирский государственный технический университет,-1,-1,-1,-1,-1,-1,-1,-1,216038,2,171356,2,174986,2,186080,9,192587,12,6,3,15,0.0
6254,ФГБОУ ВО Новосибирский государственный архитектурно-строительный университет (Сибстин),-1,-1,181518,1,-1,-1,176952,1,286912,1,292131,1,376484,1,155523,6,144463,7,6,-7,-6,1.33
6263,ФГБОУ ВО Московский государственный юридический университет имени О.Е. Кутафина (МГЮА),-1,-1,369730,1,167637,3,128437,4,211949,4,168222,3,240693,3,157679,15,132399,16,6,-16,-15,0.67
6267,ФГБОУ ВО Национальный исследовательский Московский государственный строительный университет,-1,-1,-1,-1,-1,-1,145779,3,165032,1,181610,1,227209,1,197829,9,237265,10,6,19,25,2.43
6271,ФГБОУ ВО Российский экономический университет имени Г.В. Плеханова,-1,-1,-1,-1,-1,-1,175101,28,122185,31,162798,26,154946,22,103753,55,99530,80,26,-43,11,0.73
6273,ФГБОУ ВО Московский государственный университет технологий и управления имени К.Г. Разумовского (ПКУ),-1,-1,-1,-1,-1,-1,103823,15,141842,12,-1,-1,91113,18,73745,55,-1,-1,19,-28,75,2.25
6276,ФГБОУ ВО Московская государственная художественно-промышленная академия имени С.Г. Строганова,-1,-1,-1,-1,-1,-1,-1,-1,56095,3,58275,6,90049,8,70692,18,65574,14,13,12,230,0.75
6278,ФГБОУ ВО Российский государственный гуманитарный университет,-1,-1,352773,1,104399,27,108618,13,102040,12,253030,2,123842,2,213015,1,-1,-1,18,-2,-38,-0.97
6281,ФГБОУ ВО Московский автомобильно-дорожный государственный технический университет,-1,-1,-1,-1,-1,-1,-1,-1,94053,6,-1,-1,-1,-1,170107,14,112600,29,14,19,162,0.0
6283,ФГБОУ ВО Московский педагогический государственный университет,-1,-1,-1,-1,-1,-1,120124,1,107685,10,149348,2,-1,-1,160541,11,121918,16,14,13,61,-3.3
6288,ФГАОУ ВО Национальный исследовательский технологический университет МИСиС,-1,-1,-1,-1,-1,-1,-1,-1,130661,3,70114,1,54116,1,125903,15,95472,24,6,-24,28,2.46
6290,ФГАОУ ВО Национальный исследовательский Нижегородский государственный университет имени Н.И. Лобачевского,-1,-1,-1,-1,58308,4,78202,7,71370,4,80814,3,96406,3,146299,17,157323,19,26,101,249,1.83
6301,ФГБОУ ВО Пензенский государственный технологический университет,-1,-1,-1,-1,-1,-1,119170,1,101457,5,96782,4,109485,4,111065,11,149291,7,6,34,26,6.92
6303,ФГБОУ ВО Пензенский государственный университет,-1,-1,-1,-1,261862,1,54754,3,161215,6,174404,6,113994,5,-1,-1,126419,13,14,-21,64,3.17
6305,ФГБОУ ВО Астраханский государственный университет,-1,-1,-1,-1,-1,-1,-1,-1,200754,2,161130,2,144629,2,90414,19,158670,9,6,75,-28,3.92
6310,ФГАОУ ВО Волгоградский государственный университет,-1,-1,-1,-1,-1,-1,-1,-1,-1,-1,-1,-1,-1,-1,119289,14,110107,15,6,-7,-6,0.33
6311,ФГБОУ ВО Чеченский государственный педагогический университет,-1,-1,-1,-1,-1,-1,-1,-1,171743,2,187732,2,197162,2,241338,9,180250,8,6,-25,-26,2.67
6315,ФГБОУ ВО Северо-Осетинский государственный университет имени Коста Левановича Хетагурова,-1,-1,-1,-1,177586,1,230671,1,228081,1,124838,3,149847,4,102794,11,102124,11,6,0,0,3.03
6316,ФГБОУ ВО Северо-Кавказский горно-металлургический институт (государственный технологический университет),-1,-1,144171,1,219841,1,212384,1,186802,2,-1,-1,-1,-1,129365,38,121675,17,6,-5,-34,0.0
6317,ФГБОУ ВО Дагестанский государственный университет,-1,-1,320666,1,44621,6,44875,5,83700,4,84653,7,68571,7,91909,16,108715,1,27,105,266,0.7
6318,ФГБОУ ВО Дагестанский государственный технический университет,-1,-1,-1,-1,-1,-1,32169,4,93892,4,109923,4,36270,4,46566,14,54743,12,6,17,9,4.42
6322,ФГАОУ ВО Крымский федеральный университет имени В.И. Вернадского*,-1,-1,-1,-1,-1,-1,100399,3,117655,14,105724,14,104417,14,87420,44,77592,41,14,-34,42,1.5
6323,ФГАОУ ВО Южный федеральный университет,-1,-1,80307,8,128046,3,88545,2,82818,2,74337,7,137891,4,39498,2,-1,-1,33,-7,-8,3.39
6324,ФГАОУ ВО Сибирский федеральный университет,-1,-1,-1,-1,122090,2,151383,3,132420,11,-1,-1,-1,-1,136618,22,167770,25,14,26,43,0.73
6325,ФГАОУ ВО Уральский федеральный университет имени первого Президента России Б.Н.Ельцина,-1,-1,-1,-1,-1,-1,79781,6,94804,5,129229,3,174402,3,94052,25,115545,30,26,44,354,2.42
6326,ФГАОУ ВО Северо-Кавказский федеральный университет,-1,-1,-1,-1,-1,-1,-1,-1,-1,-1,197172,9,-1,-1,178212,31,-1,-1,6,-9,80,-0.42
6329,ФГБОУ ВО Орловский государственный университет имени И.С. Тургенева,-1,-1,-1,-1,-1,-1,-1,-1,-1,-1,127597,6,105794,6,284489,1,-1,-1,2,-17,-17,12.5
6335,ФГБОУ ВО Ульяновский государственный педагогический университет имени И.Н. Ульянова,-1,-1,-1,-1,-1,-1,-1,-1,290464,1,269202,1,253759,1,147826,8,124595,8,6,-15,-15,1.5
6339,ФГБОУ ВО Тульский государственный университет,-1,-1,-1,-1,-1,-1,-1,-1,331851,1,306608,1,298255,1,261823,8,300848,10,6,14,20,0.36
6340,ФГБОУ ВО Псковский государственный университет,-1,-1,-1,-1,-1,-1,-1,-1,-1,-1,-1,-1,-1,-1,126487,19,75252,13,6,-40,-47,-0.83
6342,ФГБОУ ВО Казанский национальный исследовательский технический университет имени А.Н.Туполева - КАИ,-1,-1,114390,10,114658,8,86287,10,93849,11,167052,7,167404,5,137399,18,83897,24,51,-26,73,1.25
6345,ФГБОУ ВО Приамурский государственный университет имени Шолом-Алейхема,-1,-1,356290,1,248945,1,168132,1,241090,6,242844,1,-1,-1,146727,6,149681,6,14,-37,-37,-1.08
6346,ФГБОУ ВО Казанский национальный исследовательский технологический университет,-1,-1,-1,-1,-1,-1,-1,-1,140717,8,-1,-1,-1,-1,177096,18,-1,-1,8,25,114,-0.12
6355,ФГБОУ ВО Казанский государственный архитектурно-строительный университет,-1,-1,-1,-1,143099,1414,169059,1,270861,1,281312,1,327389,1,247793,6,194978,7,35,36,-52,-1.25
6358,ФГБОУ ВО Тверской государственный технический университет,-1,-1,47083,1,48807,3,50629,3,56213,3,52825,3,53952,11,214032,9,-1,-1,4,296,16,0.0
6363,ФГБОУ ВО Югорский государственный университет,-1,-1,119348,3,124592,3,204271,6,-1,-1,-1,-1,-1,-1,210638,24,206767,24,26,1,40,1.5
6364,ФГБОУ ВО Южно-Российский государственный политехнический университет (НПИ) имени М.И. Платова,-1,-1,-1,-1,203980,1,92784,6,80966,15,-1,-1,-1,-1,117177,16,-1,-1,19,26,125,0.72
6365,ФГБОУ ВПО Государственный университет-учебно-научно-производственный комплекс (теперь Орловский государственный университет имени И.С. Тургенева),-1,-1,-1,-1,-1,-1,-1,-1,-1,-1,127597,6,105794,6,-1,-1,-1,-1,2,-17,-17,12.5
6366,ФГБОУ ВО Национальный исследовательский университет Московский энергетический институт,-1,-1,-1,-1,-1,-1,112288,3,-1,-1,-1,-1,356668,1,194819,13,132154,10,6,-32,-43,0.0
6370,ФГАОУ ВО Белгородский государственный национальный исследовательский университет,-1,-1,272419,1,223795,1,216162,1,284998,1,260809,3,216597,2,184039,16,183112,19,6,0,6,0.21
6374,ФГБОУ ВО Вятский государственный университет,-1,-1,329580,1,310391,1,237745,1,190015,2,86580,2,271871,1,206052,9,224678,8,6,9,7,0.17
6380,ФГБОУ ВО Красноярский государственный педагогический университет имени В.П. Астафьева,-1,-1,-1,-1,103209,1,-1,-1,28946,1,-1,-1,346897,1,168280,7,165250,7,6,-1,-1,1.0
6381,ФГБОУ ВО Мурманский арктический государственный университет,-1,-1,-1,-1,-1,-1,-1,-1,321065,5,-1,-1,-1,-1,149980,12,167684,10,6,11,3,2.5
6382,ФГБОУ ВО Сыктывкарский государственный университет имени Питирима Сорокина,-1,-1,-1,-1,-1,-1,-1,-1,-1,-1,-1,-1,-1,-1,149053,10,192993,9,6,29,15,1.83
6383,ФГБОУ ВО Ухтинский государственный технический университет,-1,-1,-1,-1,-1,-1,-1,-1,210826,3,173569,5,218718,5,136941,13,122948,12,6,-10,-12,-0.33
6384,ФГАОУ ВО Российский университет дружбы народов,-1,-1,71139,4,92118,6,70467,6,151920,3,223119,3,265741,1,387574,4,151629,9,35,64,241,2.24
6387,ФГБОУ ВО Тюменский индустриальный университет,-1,-1,-1,-1,167638,11,189046,8,239691,7,207415,3,253003,5,137742,17,-1,-1,27,-17,28,0.51
6388,ФГАОУ ВО Тюменский государственный университет,-1,-1,83416,1,116388,8,206339,7,263509,6,169335,3,238612,6,162490,16,174447,17,35,49,93,0.64
6390,ФГБОУ ВО Алтайский государственный медицинский университет,-1,-1,-1,-1,126090,6,-1,-1,148358,7,146931,7,151621,6,173754,5,178049,8,35,41,49,1.67
6391,ФГБОУ ВО Амурская государственная медицинская академия,-1,-1,-1,-1,-1,-1,146935,7,139648,7,143980,6,140471,6,200432,5,256224,6,26,74,65,2.31
6392,ФГБОУ ВО Астраханский государственный медицинский университет,-1,-1,-1,-1,164922,6,189060,6,166678,7,195031,7,195500,7,254277,6,181482,8,35,10,17,1.59
6393,ФГБОУ ВО Башкирский государственный медицинский университет,-1,-1,-1,-1,214031,1,167744,4,169784,8,131344,24,89588,20,81453,24,-1,-1,8,-52,32,4.83
6394,ФГБОУ ВО Тихоокеанский государственный медицинский университет,-1,-1,-1,-1,-1,-1,203607,7,252185,7,200996,4,267532,6,191144,14,-1,-1,19,-6,31,2.73
6398,ФГБОУ ВО Дагестанский государственный медицинский университет,-1,-1,-1,-1,-1,-1,-1,-1,87722,7,71785,14,106787,12,-1,-1,-1,-1,4,21,25,8.88
6402,ФГБОУ ВО Ижевская государственная медицинская академия,-1,-1,-1,-1,-1,-1,70704,14,95081,10,108351,8,110176,7,135856,7,129605,11,26,83,57,0.92
6403,ФГБОУ ВО Иркутский государственный медицинский университет,-1,-1,-1,-1,-1,-1,142262,8,129356,12,97370,24,280843,1,119245,24,125176,22,26,-12,36,3.24
6405,ФГБОУ ВО Кемеровский государственный медицинский университет министерства здравоохранения РФ,-1,-1,-1,-1,-1,-1,111035,6,122023,7,77256,9,138670,5,74419,8,116348,6,26,4,4,1.98
6406,ФГБОУ ВО Кировский государственный медицинский университет,-1,-1,-1,-1,-1,-1,-1,-1,95549,7,105421,8,116120,7,119367,5,164416,5,4,21,21,8.25
