8789,Министерство здравоохранения Тверской области,50882,40,67088,143,82850,99,66960,55,84621,148,85741,146,86019,141,91163,146,96864,128,68,90,181,1.23
8857,Министерство здравоохранения Республики Тыва,-1,-1,-1,-1,-1,-1,63175,18,57765,17,71594,6,90821,41,-1,-1,-1,-1,14,43,92,0.25
8884,Министерство здравоохранения Тульской области,-1,-1,-1,-1,-1,-1,-1,-1,-1,-1,-1,-1,47536,48,59158,52,64058,41,10,34,29,3.0
9000,Министерство здравоохранения Хабаровского края,-1,-1,-1,-1,-1,-1,-1,-1,-1,-1,-1,-1,139424,133,166666,132,149932,142,10,7,12,0.75
9089,Министерство здравоохранения Челябинской области,-1,-1,-1,-1,-1,-1,-1,-1,-1,-1,-1,-1,80616,220,86411,218,91819,191,10,13,6,2.1
9116,Министерство здравоохранения Чеченской Республики,-1,-1,-1,-1,-1,-1,-1,-1,-1,-1,-1,-1,52463,17,71645,14,78687,13,10,49,40,1.9
9191,Департамент здравоохранения Ямало-Ненецкого АО,-1,-1,-1,-1,-1,-1,-1,-1,-1,-1,-1,-1,264084,49,299216,52,276647,57,10,4,12,0.7
9225,Департамент здравоохранения и фармации Ярославской области,-1,-1,-1,-1,-1,-1,-1,-1,-1,-1,-1,-1,77236,123,109039,110,104582,102,10,35,23,3.0
9260,Министерство здравоохранения Московской области,-1,-1,-1,-1,-1,-1,-1,-1,-1,-1,-1,-1,163961,247,185815,235,-1,-1,4,13,12,3.0
9295,Департамент здравоохранения Владимирской области,-1,-1,-1,-1,-1,-1,-1,-1,-1,-1,-1,-1,94428,107,101728,116,92341,105,10,-2,-2,1.2
9323,Министерство здравоохранения Забайкальского края,-1,-1,-1,-1,-1,-1,-1,-1,-1,-1,-1,-1,87530,106,102132,105,107051,85,10,22,11,2.65
